{
    "$id": "https://github.com/kpopdb/kpopdb/blob/master/idol.schema.json",
    "$schema": "http://json-schema.org/draft-07/schema#",
    "required": [
      "givenName",
      "givenNameRoman",
      "givenNameKorean",
      "givenNameKoreanRoman",
      "familyName",
      "familyNameRoman",
      "stageNameHangul",
      "stageNameRoman",
      "birthday",
      "nationality",
      "status",
      "sex"
    ],
    "title": "Idol",
    "type": "object",
    "properties": {
        "givenName": {
            "description": "Given (first) name in native language",
            "type": "string"
        },
        "givenNameRoman": {
            "description": "Given (first) name romanized",
            "type": "string"
        },
        "givenNameKorean": {
            "description": "Korean given (first) name",
            "type": "string"
        },
        "givenNameKoreanRoman": {
            "description": "Korean given (first) name romanized",
            "type": "string"
        },
        "familyName": {
            "description": "Family (last) name",
            "type": "string"
        },
        "familyNameRoman": {
            "description": "Family (last) name Romanzied",
            "type": "string"
        },
        "familyNameKorean": {
            "description": "Korean family (last) name in Hangul",
            "type": "string"
        },
        "familyNameKoreanRoman": {
            "description": "Korean family (last) name in Hangul",
            "type": "string"
        },
        "stageNameHangul": {
            "description": "Stage (last) name in Hangul",
            "type": "string"
        },
        "stageNameRoman": {
            "description": "Stage (last) name Romanzied",
            "type": "string"
        },
        "birthday": {
            "description": "Birthday",
            "type": "string",
            "format": "date"
        },
        "sex": {
            "description": "Idol's sex",
            "enum": ["male", "female"]
        },
        "nationality": {
            "description": "Nationality",
            "enum": ["korean", "chinese", "thai", "korean-american"]
        },
        "groupHangul": {
            "description": "Group name in Hangul",
            "type": "string"
        },
        "groupRoman": {
            "description": "Group name Romanized",
          "type": "string"
        },
        "solo": {
            "description": "Is the idol a solo performer?",
          "type": "boolean"
        },
        "soloDebutDate": {
            "description": "Solo Debut Date",
            "type": "string",
            "format": "date"
        },
        "status": {
            "description": "Idol's activity status",
            "enum": ["active", "inactive", "former"]
        }
    }
}
