{
    "givenName": "주현",
    "givenNameRoman": "Joohyun",
    "givenNameKorean": "주현",
    "givenNameKoreanRoman": "Joohyun",
    "familyName": "서",
    "familyNameRoman": "Seo",
    "familyNameKorean": "서",
    "familyNameKoreanRoman": "Seo",
    "stageNameHangul": "서현",
    "stageNameRoman": "Seohyun",
    "birthday": "1991-06-28",
    "sex": "female",
    "nationality": "korean",
    "groupHangul": "소녀시대",
    "groupRoman": "Girls' Generation",
    "status": "active"
}

