{
    "givenName": "수영",
    "givenNameRoman": "Sooyoung",
    "givenNameKorean": "수영",
    "givenNameKoreanRoman": "Sooyoung",
    "familyName": "최",
    "familyNameRoman": "Choi",
    "familyNameKorean": "최",
    "familyNameKoreanRoman": "Choi",
    "stageNameHangul": "수영",
    "stageNameRoman": "Sooyoung",
    "birthday": "1989-03-09",
    "sex": "female",
    "nationality": "korean",
    "groupHangul": "소녀시대",
    "groupRoman": "Girls' Generation",
    "status": "active"
}

