{
    "givenName": "찬",
    "givenNameRoman": "Chan",
    "givenNameKorean": "찬",
    "givenNameKoreanRoman": "Chan",
    "familyName": "이",
    "familyNameRoman": "Lee",
    "familyNameKorean": "이",
    "familyNameKoreanRoman": "Lee",
    "stageNameHangul": "디노",
    "stageNameRoman": "Dino",
    "birthday": "1999-02-11",
    "sex": "male",
    "nationality": "korean",
    "groupHangul": "세븐틴",
    "groupRoman": "SEVENTEEN",
    "status": "active"
}

