{
    "givenName": "순영",
    "givenNameRoman": "Soonyoung",
    "givenNameKorean": "순영",
    "givenNameKoreanRoman": "Soonyoung",
    "familyName": "권",
    "familyNameRoman": "Kwon",
    "familyNameKorean": "권",
    "familyNameKoreanRoman": "Kwon",
    "stageNameHangul": "호시",
    "stageNameRoman": "Hoshi",
    "birthday": "1996-06-15",
    "sex": "male",
    "nationality": "korean",
    "groupHangul": "세븐틴",
    "groupRoman": "SEVENTEEN",
    "status": "active"
}

