{
    "givenName": "Hansol",
    "givenNameRoman": "Hansol",
    "givenNameKorean": "한솔",
    "givenNameKoreanRoman": "Hansol",
    "familyName": "Chwe",
    "familyNameRoman": "Chwe",
    "familyNameKorean": "최",
    "familyNameKoreanRoman": "Choi",
    "stageNameHangul": "버논",
    "stageNameRoman": "Vernon",
    "birthday": "1998-02-18",
    "sex": "male",
    "nationality": "korean-american",
    "groupHangul": "세븐틴",
    "groupRoman": "SEVENTEEN",
    "status": "active"
}

