{
    "givenName": "승관",
    "givenNameRoman": "Seungkwan",
    "givenNameKorean": "승관",
    "givenNameKoreanRoman": "Seungkwan",
    "familyName": "부",
    "familyNameRoman": "Boo",
    "familyNameKorean": "부",
    "familyNameKoreanRoman": "Boo",
    "stageNameHangul": "승관",
    "stageNameRoman": "Seungkwan",
    "birthday": "1998-01-06",
    "sex": "male",
    "nationality": "korean",
    "groupHangul": "세븐틴",
    "groupRoman": "SEVENTEEN",
    "status": "active"
}

