{
    "givenName": "지원",
    "givenNameRoman": "Jiwon",
    "givenNameKorean": "지원",
    "givenNameKoreanRoman": "Jiwon",
    "familyName": "박",
    "familyNameRoman": "Park",
    "familyNameKorean": "박",
    "familyNameKoreanRoman": "Park",
    "stageNameHangul": "지원",
    "stageNameRoman": "Jiwon",
    "birthday": "1998-03-20",
    "sex": "female",
    "nationality": "korean",
    "groupHangul": "프로미스나인",
    "groupRoman": "fromis_9",
    "status": "active"
}
