{
    "givenName": "지헌",
    "givenNameRoman": "Jiheon",
    "givenNameKorean": "지헌",
    "givenNameKoreanRoman": "Jiheon",
    "familyName": "백",
    "familyNameRoman": "Baek",
    "familyNameKorean": "백",
    "familyNameKoreanRoman": "Baek",
    "stageNameHangul": "지헌",
    "stageNameRoman": "Jiheon",
    "birthday": "2003-04-17",
    "sex": "female",
    "nationality": "korean",
    "groupHangul": "프로미스나인",
    "groupRoman": "fromis_9",
    "status": "active"
}

