{
    "givenName": "규리",
    "givenNameRoman": "Gyuri",
    "givenNameKorean": "규리",
    "givenNameKoreanRoman": "Gyuri",
    "familyName": "장",
    "familyNameRoman": "Jang",
    "familyNameKorean": "장",
    "familyNameKoreanRoman": "Jang",
    "stageNameHangul": "규리",
    "stageNameRoman": "Gyuri",
    "birthday": "1997-12-27",
    "sex": "female",
    "nationality": "korean",
    "groupHangul": "프로미스나인",
    "groupRoman": "fromis_9",
    "status": "active"
}
