{
    "givenName": "시연",
    "givenNameRoman": "Siyeon",
    "givenNameKorean": "시연",
    "givenNameKoreanRoman": "Siyeon",
    "familyName": "이",
    "familyNameRoman": "Lee",
    "familyNameKorean": "이",
    "familyNameKoreanRoman": "Lee",
    "stageNameHangul": "시연",
    "stageNameRoman": "Siyeon",
    "birthday": "1995-10-01",
    "sex": "female",
    "nationality": "korean",
    "groupHangul": "드림캐쳐",
    "groupRoman": "Dreamcatcher",
    "status": "active"
}
