{
    "givenName": "시아",
    "givenNameRoman": "Shiah",
    "givenNameKorean": "시아",
    "givenNameKoreanRoman": "Shiah",
    "familyName": "유",
    "familyNameRoman": "Yoo",
    "familyNameKorean": "유",
    "familyNameKoreanRoman": "Yoo",
    "stageNameHangul": "유아",
    "stageNameRoman": "YooA",
    "birthday": "1995-09-17",
    "sex": "female",
    "nationality": "korean",
    "groupHangul": "오마이걸",
    "groupRoman": "OH MY GIRL",
    "status": "active"
}


