{
    "givenName": "가현",
    "givenNameRoman": "Gahyeon",
    "givenNameKorean": "가현",
    "givenNameKoreanRoman": "Gahyeon",
    "familyName": "이",
    "familyNameRoman": "Lee",
    "familyNameKorean": "이",
    "familyNameKoreanRoman": "Lee",
    "stageNameHangul": "가현",
    "stageNameRoman": "Gahyeon",
    "birthday": "1999-02-03",
    "sex": "female",
    "nationality": "korean",
    "groupHangul": "드림캐쳐",
    "groupRoman": "Dreamcatcher",
    "status": "active"
}
