{
    "givenName": "Jessica",
    "givenNameRoman": "Jessica",
    "givenNameKorean": "수연",
    "givenNameKoreanRoman": "Sooyeon",
    "familyName": "정",
    "familyNameRoman": "Jung",
    "familyNameKorean": "정",
    "familyNameKoreanRoman": "Jung",
    "stageNameHangul": "태연",
    "stageNameRoman": "Jessica",
    "birthday": "1989-04-18",
    "sex": "female",
    "nationality": "korean-american",
    "solo": true,
    "soloDebutDate": "2016-05-16",
    "status": "inactive"
}
