{
    "givenName": "유빈",
    "givenNameRoman": "Yubin",
    "givenNameKorean": "유빈",
    "givenNameKoreanRoman": "Yubin",
    "familyName": "이",
    "familyNameRoman": "Lee",
    "familyNameKorean": "이",
    "familyNameKoreanRoman": "Lee",
    "stageNameHangul": "다미",
    "stageNameRoman": "Dami",
    "birthday": "1997-03-07",
    "sex": "female",
    "nationality": "korean",
    "groupHangul": "드림캐쳐",
    "groupRoman": "Dreamcatcher",
    "status": "active"
}
