{
    "givenName": "원우",
    "givenNameRoman": "Wonwoo",
    "givenNameKorean": "원우",
    "givenNameKoreanRoman": "Wonwoo",
    "familyName": "전",
    "familyNameRoman": "Jeon",
    "familyNameKorean": "전",
    "familyNameKoreanRoman": "Jeon",
    "stageNameHangul": "원우",
    "stageNameRoman": "Wonwoo",
    "birthday": "1996-07-17",
    "sex": "male",
    "nationality": "korean",
    "groupHangul": "세븐틴",
    "groupRoman": "SEVENTEEN",
    "status": "active"
}

