{
    "givenName": "지호",
    "givenNameRoman": "Jiho",
    "givenNameKorean": "지호",
    "givenNameKoreanRoman": "Jiho",
    "familyName": "김",
    "familyNameRoman": "Kim",
    "familyNameKorean": "김",
    "familyNameKoreanRoman": "Kim",
    "stageNameHangul": "지호",
    "stageNameRoman": "Jiho",
    "birthday": "1997-04-04",
    "sex": "female",
    "nationality": "korean",
    "groupHangul": "오마이걸",
    "groupRoman": "OH MY GIRL",
    "status": "active"
}

