{
    "givenName": "Joshua",
    "givenNameRoman": "Joshua",
    "givenNameKorean": "지수",
    "givenNameKoreanRoman": "Jisoo",
    "familyName": "홍",
    "familyNameRoman": "Hong",
    "familyNameKorean": "홍",
    "familyNameKoreanRoman": "Hong",
    "stageNameHangul": "조슈아",
    "stageNameRoman": "Joshua",
    "birthday": "1995-12-30",
    "sex": "male",
    "nationality": "korean-american",
    "groupHangul": "세븐틴",
    "groupRoman": "SEVENTEEN",
    "status": "active"
}



