{
    "givenName": "미현",
    "givenNameRoman": "Mihyun",
    "givenNameKorean": "미현",
    "givenNameKoreanRoman": "Mihyun",
    "familyName": "김",
    "familyNameRoman": "Kim",
    "familyNameKorean": "김",
    "familyNameKoreanRoman": "Kim",
    "stageNameHangul": "미미",
    "stageNameRoman": "Mimi",
    "birthday": "1995-05-01",
    "sex": "female",
    "nationality": "korean",
    "groupHangul": "오마이걸",
    "groupRoman": "OH MY GIRL",
    "status": "active"
}

