{
    "givenName": "승철",
    "givenNameRoman": "Seungcheol",
    "givenNameKorean": "승철",
    "givenNameKoreanRoman": "Seungcheol",
    "familyName": "최",
    "familyNameRoman": "Choi",
    "familyNameKorean": "최",
    "familyNameKoreanRoman": "Choi",
    "stageNameHangul": "에스쿱스",
    "stageNameRoman": "S.Coups",
    "birthday": "1995-08-08",
    "sex": "male",
    "nationality": "korean",
    "groupHangul": "세븐틴",
    "groupRoman": "SEVENTEEN",
    "status": "active"
}
