{
    "givenName": "지선",
    "givenNameRoman": "Jisun",
    "givenNameKorean": "지선",
    "givenNameKoreanRoman": "Jisun",
    "familyName": "노",
    "familyNameRoman": "Roh",
    "familyNameKorean": "노",
    "familyNameKoreanRoman": "Roh",
    "stageNameHangul": "지선",
    "stageNameRoman": "Jisun",
    "birthday": "1998-11-23",
    "sex": "female",
    "nationality": "korean",
    "groupHangul": "프로미스나인",
    "groupRoman": "fromis_9",
    "status": "active"
}

