{
    "givenName": "채영",
    "givenNameRoman": "Chaeyoung",
    "givenNameKorean": "채영",
    "givenNameKoreanRoman": "Chaeyoung",
    "familyName": "이",
    "familyNameRoman": "Lee",
    "familyNameKorean": "이",
    "familyNameKoreanRoman": "Lee",
    "stageNameHangul": "채영",
    "stageNameRoman": "Chaeyoung",
    "birthday": "2000-05-14",
    "sex": "female",
    "nationality": "korean",
    "groupHangul": "프로미스나인",
    "groupRoman": "fromis_9",
    "status": "active"
}
