{
    "givenName": "민지",
    "givenNameRoman": "Minji",
    "givenNameKorean": "민지",
    "givenNameKoreanRoman": "Minji",
    "familyName": "김",
    "familyNameRoman": "Kim",
    "familyNameKorean": "김",
    "familyNameKoreanRoman": "Kim",
    "stageNameHangul": "지유",
    "stageNameRoman": "JiU",
    "birthday": "1994-05-17",
    "sex": "female",
    "nationality": "korean",
    "groupHangul": "드림캐쳐",
    "groupRoman": "Dreamcatcher",
    "status": "active"
}
