{
    "givenName": "예원",
    "givenNameRoman": "Yewon",
    "givenNameKorean": "예원",
    "givenNameKoreanRoman": "Yewon",
    "familyName": "최",
    "familyNameRoman": "Choi",
    "familyNameKorean": "최",
    "familyNameKoreanRoman": "Choi",
    "stageNameHangul": "아린",
    "stageNameRoman": "Arin",
    "birthday": "1999-06-18",
    "sex": "female",
    "nationality": "korean",
    "groupHangul": "오마이걸",
    "groupRoman": "OH MY GIRL",
    "status": "active"
}

