{
    "givenName": "유현",
    "givenNameRoman": "Yoohyeon",
    "givenNameKorean": "유현",
    "givenNameKoreanRoman": "Yoohyeon",
    "familyName": "김",
    "familyNameRoman": "Kim",
    "familyNameKorean": "김",
    "familyNameKoreanRoman": "Kim",
    "stageNameHangul": "유현",
    "stageNameRoman": "Yoohyeon",
    "birthday": "1997-01-07",
    "sex": "female",
    "nationality": "korean",
    "groupHangul": "드림캐쳐",
    "groupRoman": "Dreamcatcher",
    "status": "active"
}

